{
  "id": "Q-SEC-001",
  "text": "¿Cuál describe mejor la sospecha de seguridad?",
  "type": "single",
  "answers": [
    {
      "value": "defender-alert",
      "label": "Microsoft Defender mostró una alerta o puso algo en cuarentena",
      "addsEvidence": [
        "defenderAlertDetected"
      ]
    },
    {
      "value": "suspicious-file",
      "label": "Abrí o descargué un archivo sospechoso",
      "addsEvidence": [
        "suspiciousFileExecuted"
      ]
    },
    {
      "value": "strange-behavior",
      "label": "Hay ventanas, redirecciones o procesos extraños, pero Defender no detecta nada",
      "addsEvidence": [
        "malwareSymptomsNoDetection"
      ]
    },
    {
      "value": "persistent-threat",
      "label": "La amenaza reaparece después de eliminarla",
      "addsEvidence": [
        "persistentThreat"
      ]
    }
  ],
  "status": "active",
  "version": "1.0.0"
}