{
  "id": "Q-BOOT-001",
  "text": "¿Qué ocurre cuando intentas iniciar Windows?",
  "type": "single",
  "answers": [
    {
      "value": "automatic-repair",
      "label": "Entra en Reparación automática o no pasa del logotipo",
      "addsEvidence": [
        "automaticRepairLoop"
      ]
    },
    {
      "value": "after-update",
      "label": "Dejó de iniciar justo después de una actualización",
      "addsEvidence": [
        "bootFailureAfterUpdate"
      ]
    },
    {
      "value": "after-change",
      "label": "Falló después de instalar un programa o controlador",
      "addsEvidence": [
        "bootFailureAfterChange"
      ]
    },
    {
      "value": "no-boot-device",
      "label": "Aparece No boot device o entra directamente en BIOS/UEFI",
      "addsEvidence": [
        "bootDriveNotDetected"
      ]
    }
  ],
  "status": "active",
  "version": "1.0.0"
}